,Unnamed: 0,latitude,longitude,address
454,454,55.7080774,37.4833523,"город Москва, Веерная улица, дом 4, корпус 2"
455,455,55.636245,37.5115931,"город Москва, улица Островитянова, дом 18"
456,456,55.5019864,37.6020376,"город Москва, улица Брусилова, дом 41"
457,457,55.8026211,37.6315233,"город Москва, улица Годовикова, дом 2"
458,458,55.8949705,37.5300414,"город Москва, Клязьминская улица, дом 32"
459,459,55.7094494,37.852336,"город Москва, Большая Косинская улица, дом 16, корпус 1"
460,460,55.7402432,37.7066935,"город Москва, Подъёмная улица, дом 10"
461,461,55.7486062,37.5720443471473,"город Москва, набережная Тараса Шевченко, дом 3"
462,462,55.8267493,37.4561373,"город Москва, Большая Набережная улица, дом 9"
463,463,55.6336696,37.5183123,"город Москва, Профсоюзная улица, дом 122"
